Category,Count,Examples
US and International News,0,
Log files and error reports,0,
"License, terms of use, copyright notices",0,
"Lists of named items (games, countries, etc.)",0,
Forum or Wiki entry,0,
Valid URLs,0,
Named individuals (non-news samples only),24,ian.smith; jeffrey; jeffrey; karen dennecorpenronenron; karen dennecorpenronenron; kathryn; kathryn; mary hainhouect; mary hainhouect; tana jones; tana jones
"Promotional content (products, subscriptions, etc.)",0,
"High entropy (UUIDs, base64 data)",0,
